{
  "cau_hinh": {
    "mon": "Vật lí",
    "lop": 9,
    "chu_de": "Định luật Ohm và đoạn mạch nối tiếp, song song",
    "bo_sach": "Kết nối tri thức",
    "muc_dich": "on_tap",
    "tang": [1, 2, 3, 4],
    "ghi_chu": "Bộ mẫu tham chiếu của skill - dùng làm khuôn khi sinh chủ đề khác."
  },

  "muc_tieu": [
    { "ma": "MT1", "noi_dung": "Phát biểu được định luật Ohm và viết được hệ thức I = U/R, nêu đúng tên và đơn vị của từng đại lượng.", "muc_do": "NB" },
    { "ma": "MT2", "noi_dung": "Nêu được cách mắc và công dụng của ampe kế, vôn kế trong mạch điện.", "muc_do": "NB" },
    { "ma": "MT3", "noi_dung": "Phân biệt được đoạn mạch nối tiếp và đoạn mạch song song qua sơ đồ mạch và qua quan hệ giữa U, I, R.", "muc_do": "TH" },
    { "ma": "MT4", "noi_dung": "Tính được một trong ba đại lượng U, I, R khi biết hai đại lượng còn lại, có thực hiện quy đổi đơn vị.", "muc_do": "VD" },
    { "ma": "MT5", "noi_dung": "Tính được điện trở tương đương và phân bố U, I trong đoạn mạch nối tiếp, song song.", "muc_do": "VD" },
    { "ma": "MT6", "noi_dung": "Đọc được đồ thị đặc tuyến I - U và rút ra kết luận về sự phụ thuộc của cường độ dòng điện vào hiệu điện thế.", "muc_do": "TH" },
    { "ma": "MT7", "noi_dung": "Mô tả được cách bố trí và tiến hành thí nghiệm khảo sát sự phụ thuộc của I vào U đặt vào hai đầu dây dẫn.", "muc_do": "VD" },
    { "ma": "MT8", "noi_dung": "Vận dụng kiến thức về điện trở để giải thích hiện tượng và đề xuất giải pháp an toàn, tiết kiệm điện trong gia đình.", "muc_do": "VDC" }
  ],

  "nhom_bo_qua": [],

  "dang_bai_tap": [
    {
      "ma": "A1",
      "nhom": "A",
      "ten": "Nhắc lại định luật Ohm, hệ thức và đơn vị các đại lượng",
      "muc_tieu_lien_quan": ["MT1"],
      "dau_hieu_nhan_biet": "Đề yêu cầu phát biểu, viết công thức, gọi tên hoặc nêu đơn vị; không có số liệu để tính.",
      "phuong_phap": [
        "Xác định đề hỏi phát biểu, công thức hay đơn vị.",
        "Viết hệ thức I = U/R, sau đó suy ra hai dạng biến đổi U = I·R và R = U/I.",
        "Gọi tên đầy đủ và ghi kèm đơn vị: I - cường độ dòng điện (A); U - hiệu điện thế (V); R - điện trở (ohm).",
        "Nêu ý nghĩa: với cùng một dây dẫn, I tỉ lệ thuận với U và tỉ lệ nghịch với R."
      ],
      "loi_thuong_gap": [
        "Viết công thức nhưng không nêu đơn vị của các đại lượng.",
        "Nói 'điện trở tỉ lệ nghịch với cường độ dòng điện' như một tính chất của dây dẫn - sai, R là đại lượng đặc trưng cho dây, không đổi khi thay đổi U."
      ],
      "bai_tap": [
        {
          "ma": "A1.1",
          "tang": 1,
          "muc_do": "NB",
          "hinh_thuc": "dien_khuyet",
          "de": "Điền vào chỗ trống: Cường độ dòng điện chạy qua dây dẫn ...(1)... với hiệu điện thế đặt vào hai đầu dây và ...(2)... với điện trở của dây. Hệ thức: I = ...(3)...",
          "loi_giai": "Dựa trực tiếp vào phát biểu định luật Ohm trong SGK.",
          "dap_an": "(1) tỉ lệ thuận; (2) tỉ lệ nghịch; (3) U/R"
        },
        {
          "ma": "A1.2",
          "tang": 2,
          "muc_do": "NB",
          "hinh_thuc": "trac_nghiem",
          "de": "Đơn vị của điện trở là",
          "phuong_an": ["ôm (Ω)", "vôn (V)", "ampe (A)", "oát (W)"],
          "loi_giai": "R = U/I nên đơn vị là V/A, được đặt tên là ôm (Ω). V là đơn vị hiệu điện thế, A là đơn vị cường độ dòng điện, W là đơn vị công suất.",
          "dap_an": "A"
        },
        {
          "ma": "A1.3",
          "tang": 2,
          "muc_do": "TH",
          "hinh_thuc": "tu_luan",
          "de": "Viết hệ thức của định luật Ohm. Từ hệ thức đó, suy ra công thức tính hiệu điện thế và công thức tính điện trở. Nêu tên và đơn vị của từng đại lượng.",
          "loi_giai": "Hệ thức: I = U/R. Nhân hai vế với R được U = I·R. Chia hai vế của U = I·R cho I được R = U/I.",
          "dap_an": "I = U/R; U = I·R; R = U/I. I - cường độ dòng điện (A); U - hiệu điện thế (V); R - điện trở (Ω)."
        }
      ]
    },

    {
      "ma": "A2",
      "nhom": "A",
      "ten": "Nhận diện dụng cụ đo và cách mắc ampe kế, vôn kế",
      "muc_tieu_lien_quan": ["MT2"],
      "dau_hieu_nhan_biet": "Đề nhắc tới ampe kế, vôn kế, chốt (+) (-), sơ đồ mạch điện có kí hiệu A hoặc V.",
      "phuong_phap": [
        "Ampe kế đo cường độ dòng điện, mắc NỐI TIẾP với vật cần đo.",
        "Vôn kế đo hiệu điện thế, mắc SONG SONG với vật cần đo.",
        "Chốt (+) của dụng cụ nối về phía cực dương của nguồn.",
        "Chọn thang đo lớn hơn giá trị dự kiến để không làm hỏng dụng cụ."
      ],
      "loi_thuong_gap": [
        "Mắc vôn kế nối tiếp - số chỉ gần bằng 0 và mạch gần như hở.",
        "Mắc ampe kế song song với nguồn - gây đoản mạch, hỏng dụng cụ."
      ],
      "bai_tap": [
        {
          "ma": "A2.1",
          "tang": 1,
          "muc_do": "NB",
          "hinh_thuc": "noi_cot",
          "de": "Nối mỗi dụng cụ ở cột trái với cách mắc đúng ở cột phải: (1) Ampe kế; (2) Vôn kế. Cột phải: (a) mắc song song với vật cần đo; (b) mắc nối tiếp với vật cần đo.",
          "loi_giai": "Ampe kế phải để toàn bộ dòng điện đi qua nên mắc nối tiếp; vôn kế đo hiệu điện thế giữa hai điểm nên mắc song song.",
          "dap_an": "1 - b; 2 - a"
        },
        {
          "ma": "A2.2",
          "tang": 3,
          "muc_do": "TH",
          "hinh_thuc": "tu_luan",
          "de": "Bạn An mắc vôn kế nối tiếp với bóng đèn để đo hiệu điện thế hai đầu đèn. a) Dự đoán số chỉ của vôn kế và độ sáng của đèn. b) Giải thích và nêu cách mắc đúng.",
          "loi_giai": "a) Vôn kế có điện trở rất lớn; khi mắc nối tiếp, điện trở toàn mạch tăng vọt nên dòng điện gần bằng 0: đèn không sáng, vôn kế chỉ gần bằng hiệu điện thế của nguồn. b) Phải mắc vôn kế song song với hai đầu đèn.",
          "dap_an": "a) Đèn không sáng, vôn kế chỉ gần bằng U nguồn. b) Mắc vôn kế song song với đèn."
        }
      ]
    },

    {
      "ma": "B1",
      "nhom": "B",
      "ten": "Phân biệt đoạn mạch nối tiếp và đoạn mạch song song",
      "muc_tieu_lien_quan": ["MT3"],
      "dau_hieu_nhan_biet": "Đề cho sơ đồ mạch hoặc mô tả cách mắc và hỏi loại mạch, hoặc hỏi quan hệ giữa I, U, R của các phần tử.",
      "phuong_phap": [
        "Xác định số đường đi của dòng điện: một đường duy nhất là nối tiếp, từ hai đường trở lên là song song.",
        "Nối tiếp: I bằng nhau ở mọi điểm; U cộng lại; R(tđ) = R1 + R2 (luôn lớn hơn mỗi điện trở thành phần).",
        "Song song: U bằng nhau trên các nhánh; I cộng lại; 1/R(tđ) = 1/R1 + 1/R2 (R(tđ) luôn nhỏ hơn điện trở nhỏ nhất).",
        "Kiểm tra lại kết quả bằng nhận xét về độ lớn của R(tđ)."
      ],
      "loi_thuong_gap": [
        "Áp dụng nhầm công thức nối tiếp cho mạch song song.",
        "Tính 1/R(tđ) rồi quên nghịch đảo, lấy luôn kết quả làm R(tđ)."
      ],
      "bai_tap": [
        {
          "ma": "B1.1",
          "tang": 1,
          "muc_do": "NB",
          "hinh_thuc": "dung_sai",
          "de": "Xét đoạn mạch gồm hai điện trở R1 và R2 mắc nối tiếp. Cho biết mỗi nhận định sau đúng hay sai: a) Cường độ dòng điện qua R1 bằng cường độ dòng điện qua R2. b) Hiệu điện thế hai đầu đoạn mạch bằng tổng hiệu điện thế trên mỗi điện trở. c) Điện trở tương đương nhỏ hơn R1. d) Nếu R1 bị đứt thì R2 vẫn có dòng điện chạy qua.",
          "loi_giai": "a) Đúng - mạch nối tiếp chỉ có một đường đi của dòng điện. b) Đúng - U = U1 + U2. c) Sai - R(tđ) = R1 + R2 > R1. d) Sai - mạch hở nên không có dòng điện.",
          "dap_an": "a) Đ; b) Đ; c) S; d) S"
        },
        {
          "ma": "B1.2",
          "tang": 2,
          "muc_do": "TH",
          "hinh_thuc": "tu_luan",
          "de": "Nêu 2 điểm giống nhau và 2 điểm khác nhau giữa đoạn mạch nối tiếp và đoạn mạch song song gồm hai điện trở.",
          "loi_giai": "Giống: đều tuân theo định luật Ohm cho từng điện trở và cho cả đoạn mạch; đều có thể thay bằng một điện trở tương đương. Khác: nối tiếp có I bằng nhau và U cộng lại, song song có U bằng nhau và I cộng lại; R(tđ) nối tiếp lớn hơn mỗi thành phần, R(tđ) song song nhỏ hơn mỗi thành phần.",
          "dap_an": "Xem lời giải - cần nêu đủ 2 ý giống và 2 ý khác."
        },
        {
          "ma": "B1.3",
          "tang": 4,
          "muc_do": "VDC",
          "hinh_thuc": "tu_luan",
          "de": "Có hai điện trở R1 = 6 Ω và R2 = 12 Ω. Hỏi có thể tạo ra những giá trị điện trở tương đương nào từ hai điện trở này? Với mỗi giá trị, vẽ sơ đồ cách mắc và tính kết quả.",
          "loi_giai": "Có 4 cách: chỉ dùng R1 (6 Ω); chỉ dùng R2 (12 Ω); mắc nối tiếp R(tđ) = 6 + 12 = 18 Ω; mắc song song R(tđ) = (6·12)/(6+12) = 72/18 = 4 Ω.",
          "dap_an": "4 Ω; 6 Ω; 12 Ω; 18 Ω"
        }
      ]
    },

    {
      "ma": "C1",
      "nhom": "C",
      "ten": "Tính U, I, R của một điện trở bằng định luật Ohm",
      "muc_tieu_lien_quan": ["MT1", "MT4"],
      "dau_hieu_nhan_biet": "Đề cho hai trong ba đại lượng U, I, R của cùng một dây dẫn và hỏi đại lượng còn lại.",
      "phuong_phap": [
        "Tóm tắt: ghi các đại lượng đã biết kèm đơn vị.",
        "Quy đổi về đơn vị chuẩn: mA về A (chia 1000), kΩ về Ω (nhân 1000), mV về V.",
        "Chọn công thức: I = U/R hoặc U = I·R hoặc R = U/I.",
        "Thay số, tính và ghi kèm đơn vị.",
        "Kiểm tra tính hợp lí của kết quả so với thiết bị thực tế."
      ],
      "loi_thuong_gap": [
        "Quên đổi mA sang A, kết quả sai gấp 1000 lần.",
        "Ghi kết quả không kèm đơn vị.",
        "Nhầm U với I khi tóm tắt do đề cho theo thứ tự khác thường."
      ],
      "bai_tap": [
        {
          "ma": "C1.1",
          "tang": 1,
          "muc_do": "NB",
          "hinh_thuc": "tu_luan",
          "de": "Một dây dẫn có hiệu điện thế hai đầu là U = 12 V, cường độ dòng điện qua dây là I = 2 A. Tính điện trở của dây. (Gợi ý: dùng công thức R = U/I)",
          "loi_giai": "Tóm tắt: U = 12 V; I = 2 A; R = ? Công thức R = U/I. Thay số: R = 12/2 = 6 (Ω).",
          "dap_an": "R = 6 Ω"
        },
        {
          "ma": "C1.2",
          "tang": 2,
          "muc_do": "VD",
          "hinh_thuc": "tu_luan",